R_2pL8GAQOrixdTEV,The purpose of the data capture platform is to gather information on group discussions and collaboration. The data capture platform provides functionality like keyword tracking and directional audio detection.,"I would measure the amount and type of things said during a collaboration session. Another useful measurement would be seeing their contributions to the final idea, even if their ideas were rejected.",I would check out the progress made on the main task.,I would like to see the evolution of the main task as the group discusses it.,"By seeing the progress we make on the main task, I would be better able to adjust my thought process so I'm contributing useful ideas to the group.","I would like to see what I contributed to the final result, how much I spoke, and a transcript of what everyone said.",I would adjust the way I collaborate. I would also change the way collaboration is taught.
R_3kFcrxwui4CFBNp,The data capture platform is used to monitor collaboration meetings to highlight metrics that occur during the meeting using machine learning. This tool does not offer any insights but only highlights key metrics,Story board points are essential because lines written are not equal,I think peer evaluations are useful because it tells you how well the group works,A burn-up chart is useful to see if progress is accelerating or slowing ,To intervene if there is an issue arrising with the group,I would like to see peer evaluations to see how well the group viewed themselves,This information could be compared to the burn-up chart to view differences in how people view themselves versus progress
R_3HBR6KQNPFi6eWK,this platform can help us review what we have done on the class and get an idea of how everyone feels,time they spend and the result of their part of work leads to,the time we use of completing each part of job compared to the antipated time,,,the result of the work,get some lessons from where we made mistakes
R_eDucXlR8N3z6Tbr,"This device captures data about audio coming from different directions during a discussion. It creates transcripts of what was said during the discussion, that can be reviewed at a later time to revisit critical points. It also measures the amount of participation from each direction to monitor who is and isn't contributing to the same extent.","Peer reviews of performance would be useful. Additionally, clearly defined roles and responsibilities make it easier to assess who is contributing and who is lagging behind.",Output on project deliverables and the overall quality of work would be useful in evaluating collaboration quality at a group level,"Nothing comes to mind, although regular peer reviews of group member participation would be helpful in assessing who is lagging behind in the group's view of the situation","This real-time information, say on a weekly basis, can be used to adjust behavior and contribution based on anonymous peer review","Similar to real-time, peer review but maybe with the addition of manager/professor feedback (whoever is receiving the deliverable)",This post-hoc info helps assess group level collaboration as well. This is a learning experience for everybody.
R_bwQm6M2qkaqaWiJ,"The data captured shows whether or not key topics were discussed by tracking key words. Also, you can see which direction the audio came from to see if a certain group of people were not participating","Whether the person is staying on topic and focused on the task. Also, they must get along with other group members.",The group is efficiently getting through necessary tasks while ensuring that none of the members are confused or falling behind.,I am not exactly sure what is being asked here. Maybe whether we are getting through our task on par with other groups/ on schedule.,"Work to change our collaboration method, whether that means slowing down and focusing more on details or finding a way to be more fast and efficient",Whether all of the members successfully understood everything that was done by the group and whether the group achieved its goal,"For the group success, see if anything needs to be improved for the next collaboration. For a member being confused, make sure they are more included in the next collaboration"
R_3lXl2ZvfQv5C193,To gather different keywords about the capture and transcripts and also the gather different metrics that will be helpful in evaluating the group collaboration,"How much information he/she is actually providing to the team, his/her insights, contributions.","The quality of the final product itself. If the tasks the group was asked to do or their goals achieved met all the requirements needed, then that is a direct consecuence of how good the collaboration and effort of the group was.",How the group is communicating vs. the final product,To gather inputs and observations about how the group will do at the end of their tasks,How the group communication was while attempting to do their tasks vs. the final product,To see if future groups are going to have the same rights and wrongs
R_3e9qYInHSBOBWHG,They allow the capture of transcripts which then show different areas that were discussed. ,I just need to know that everyone is participating and that there is progress being done to meet our benchmarks. ,How much someone is engaged and how many of the members are present and up to date with the progress. ,questions answered (on a problem set) or how much writing they've done (in a report),To assess who's done more work and who needs to step it up a bit,A mood chart is a chart that allows people to give thoughts on how they thought the session went. ,We would see how our collaboration session was based on people's moods post collab and keep working hard on our next session. 
R_129lXfWiHNhmth8,"Blinc seems like a great tool for in class learning. By pinging the direction of the speaker and tracking that data, one gets a better idea of how much they are speaking.","Speaking time, but mainly peer feedback",Feedback from within the group is the primary and main thing that is useful for me to evaluate group level collaboration,Peer reviews weekly or biweekly strongly help,"Depending on what I see from these peer reviews, I would change my collaboration style accordingly",peer reviews,"again, peer reviews allow people to see what the main people working with them truly think about their group work"
R_2tyavwzDhOIjhns,"The purpose of the platform is to enhance collaboration. It has many features to help keep track of how the collaboration is going in real time, including a timeline, a dashboard to show when discussions are happening vs when it is silent, and a dashboard that keeps track of the direction of the conversation.","The quantity of work that they are contributing, whether their ideas are taken into account based on their quality, and whether they are doing all the work vs part of the work.",What percentage of the activity/project each person contributed to and the dynamic of the group (if some people made themselves the leaders vs if everyone is comfortable contributing equally),If each of the members are actively participating and how much of the work has been completed vs is left to do,"If it is found that some of the members are participating more than others, we can shift so that the other members participate more.",Whether every member of the group is satisfied with the work and how efficient the group was at completing the work.,"In terms of satisfaction, this can be used to gauge whether every member's ideas were taken into account. Efficiency information can be used to improve efficiency the next time around."
R_ujJDq4chx9pjGhz,"The data capture platform listens and records multiple recording devices while in discussion and then analyzes the conversation through word choice, tone, and other factors to determine how positive or negative of an experience it was.",The number of feedback/comments an individual says in response to others and how much time outside of the group they are spending to prepare for the group.,"Team chemistry, how comfortable people are with each other and with speaking up about their thoughts and opinions.",Objective good/bad/neutral information in response to real-time collaboration.,Analyze the collaboration taking place and discussing whether it is the most efficient discussion it could be. ,Suggestions on how to make collaboration more impactful and useful. General feedback on how the collaboration went.,
R_12RUUk4BlWS795c,To determine how effective group discussions and collaboration sessions are. This is by keeping track of a number of factors such as how time is being allocated in sessions and what exactly is being said,The ideas they've contributed and their attendance at group meetings. ,The overall outcome of the group project in terms of fulfilling project criteria. ,The number of times groups meet and what happens during each meeting ,To determine how to move forward and compare this with the actual progress of the team,"The coherence and consistency of the project itself, even though multiple people work on a project it should not look like it was created by different individuals. ",To evaluate how effective the team worked together and produced a consistent project/report/program.
R_214CSLo3XvFtfRC,The purpose is to better track and understand online collaboration. It picks up audio and analyzes the key words to categorize them.,"What parts of the project did they cover; did they have other miscellaneous contributions such as coordinating meetings, etc.",Quality of work completed.,,,,
R_1P1Aj7WjvsNRbos,"The purpose of the data capture platform described in the video is to provide data about how a group collaboration went. In particular, the platform produces easily digestible graphs and charts to see the kinds of topics and discussions a group is having during their collaboration.",Tracking their work and participation,"Seeing how well, clear and timely our communication is.",Everyone's participation,improve the group's collaboration,everyone's amount of work done,improve the group's collaboration
R_3NKWDMIN2wVBXjw,A platform that monitors the conversation of the group throughout meetings to allow for closer monitoring of a groups interactions,A list of what a person's contribution was to the team along with the peer review system that is commonly found at Northwestern.,I would prefer there be a team leader that can be the liaison to me and I can ask them how the group is working as a whole.,"Sitting together, talking regularly, and meetings starting with a dialogue of the goals and plan rather than immediately starting work.",I would use it to see how well information is flowing between members and how organized it is. ,The post analysis of the group on their performance. ,To see where the members are coming from and find areas that need further attention. 
R_yl6GOk575CyXl3H,Purpose to me seems to get more data around the way the discussion has been going on in the class. This should help with collaboration somehow.,,,,,,
R_3MnwNPKceXljwDi,It's a system whose purpose is improve collaborations. It uses recordings of discussions to analyze what can be improved.,Anonymous surveys done by everyone in the group to evaluate each person's contributions. ,I think a record of qualitative observations during group meetings would be helpful in these type of situations.,I would like to see information on engagement on the qualitative and quantitative level. ,I would use it to analyze the level of contribution of each team member. I would then use this information to propose adjustments to the group's work style.,I would like to see each individual members thoughts on how they contributed to the group as well as how they felt others contributed. ,"I would use this data to see what I could improve on my self, and see what worked and what did not. I would take these lessons and bring them to future collaborative projects. "
R_2cpHdLxuWkIVeuC,"The data capture platform can be used to analyze group meetings. It analyzes the periods of silence and discussion to see how efficient meetings are, and analyzes emotions to tell groups whether their discussions are positive or negative.",A method that I often use is to look at what role the participant played in the final solution of the collaborative group.,"Ideally, every member of the group would have an equal part in contributing to the final design of a group.","The progress of what they are working on, as well as what exactly they are working on, would be useful information in real time.","We can use the progress checks to figure out of the member needs help, is perfectly fine, or is on track to finish early so that the group can allocate tasks accordingly.",The overall role that each member played in the final product of the group would be useful after the collaboration is finished.,We can use the higher-level view of the collaboration to calibrate each role in future projects involving a group.
R_2720PGYi15ea7Xt,"The data capture platform described in the video would help people better understand how discussions that they are part of work on a deeper level. From key words to general trends within the discussion, it is a data-collection app to help better understand how to improve collaborations.","How active they were in the discussion, how critically they considered the opinions of others, how much the final product was influenced by their discussion, how prepared they were entering the collaboration.","How many varied opinions were considered in creating a final product, how much time was spent discussing as a group, how prepared group members entered the collaboration as","Analysis of opinions, preparation time before the actual discussion/collaboration","Knowing how much time they spent digesting the information helps me understand who's critically analyzed topics or problems that need to be addressed, and helps me know who's ready to develop not only their own ideas, but the ideas of others as well.","Who was able to contribute to what parts of the collaboration final product, whether it be in actually completing it, or in helping the group arrive at the conclusion that it did.",This would help me understand how effective the collaboration was in bringing the ideas of others together.
R_3PFG1CbhJ1rEq8X,The data capture platform focused around collaboration. It measure chemistry students and their levels of collaboration. ,"I think it would be useful to understand how and why an individual is thinking the way they are. In other words, I believe understanding one's background is vital to this. ",I think that the kind of information that would be useful to evaluate collaboration quality include discussion and opinion. ,I think that collaboration quality information that would be nice or ideal to see in real time include survey results or possibly some way to track satisfaction. ,"This real time information, in my opinion and thought, would be used to improve the level or capacity of collaboration. ","After the collaboration, I would like to see collaboration-quality information that quantifies the collaboration quality from the start to the end of the project. ",I am not yet sure how I would use this post-hoc information. I could possibly use it to cultivate a new project. 
R_2D0kKMerRf9PqRh,The purpose of the data capture platform is to take conversation and analyzing the quality. This could be useful in making sure discussions have higher quality,Useful information may include how often and for how long an individual speaks.,Useful information for determining quality of collaboration is how evenly spread out conversation is between members and for how long.,I'd like to see how long a person has given input or helped collaborate in relation to the other members.,This would help guide who to involve more in terms of discussion and actions,Maybe a rating of how welcomed and heard someone felt after the collaboration.,This could be used as reference to guide others about how to act during the collaboration.
R_3EbcGNoHsu2zHYi,The data capture platform was used to record and give metric on collaboration. The data capture platform would do this with a given array of 6 microphones and keywords. When the data capture platform was given these inputs and devices it would then provide a collaboration metric of which areas of the room had said more and what they discussed.,Written plans for delegated work and which work was completed (git commit history and a written work plan).,Overall closeness to goal as well as any significant hurdles overcome while working.,I would not like a system that gave real-time collaboration-quality information.,If this information was given real-time it would affect the workflow of the collaboration and cold potentially paint someone in a negative light.,"Time each collaborator spent working, regardless of role assigned just to better understand how difficult the parts I didn't do were to achieve.",I would use to make better informed decisions in my next collaborative effort.
R_26aHLgW9A8ZIZBr,"Recording voice analysis birth voice data, including intonation, emotion, etc.",,,,,,
R_3IVH0f5wvQh9WXu,The data capture platform in the video has a purpose of analyzing collaboration in a particular project.,How much effort have they spent in a particular project (time and efficiency as well),"How much time someone spent on a project, how many ideas/solutions they came up with.",Ask teammates to rate others on how much they are contributing so far and how effective of a teammate they are.,I'd use this to determine how well teammates are collaborating together right now and what changes they can make to increase effectiveness.,Ask teammates to rate others on how much they contributed and how effective of a teammate they were.,I'd use this to determine how well teammates collaborated throughout the whole process.
R_2BkETCTL1D2wwzc,The data capture platform records discussions and captures real time statistics about the discussion. This data can be sued to better fine-tine the collaborative learning experience.,Their level of motivation and listening skills are important pieces of information to know.,"If everyone is being heard and if everyone feels like the amount of work they do is fair, collaboration is good. Of course, end quality is an easy gauge as well.",Speaking time and variety of ideas would be interesting statistics to see in real time. Time spent collaborting vs off-task work could help.,We can encourage more silent people to speak up. We can also get on track whenever a group deviates.,"How much communication happens after a meeting. Whether it is following up on something, updating schedules and planning new meetings.",We can use this to adjust our meeting style based on the performance and "feel" of the previous meetings
R_1IbFJzN9lgYPuM6,Please provide 2-3 sentences about the purpose and functionality of the data capture platform described in the video.,Information that would that would be useful for evaluating would be work done and work done only (not hours spent or partial tasks completed)..,I think information like amount of messages sent among the team and time spent together are good metric for collaboration quality.,I team morale would be a collaboration-quality information that I would like to see in real time. ,I would use this real-time information to gauge how productive my team is going to be and hopefully make amends to boost productivity.,I would like to see some basic ratings like personal feelings and personal productivity .,I would use this post-hoc information to access how my teammates are feeling and what can be improved the next time we meet.
R_2tbbPoXI3Of1RkY,It is good. It provides a lot of data it is good. I never used such a dashboard.,Peer Evaluations - This may reveal participation issues that the instructor might not otherwise know about. Ensure that groups know how each member is doing by integrating assessment throughout the project.,Always cooperative. Routinely offers useful ideas. Always displays positive attitude. Tries to keep people working together. Almost always focused on the task. Is very self-directed.,"In realtime how a person is doing, what they are doing if they need help. Are they happy about ongoing progress.",I will use this to check with the person who is facing any problem. How we can solve it together. Do they need help or not. ,"were they satisfied with it the collaboration, how they want any changes. Are they comfartable.",I would just try to analyse the data to understand myself better and people around me. And what they want and how they want to work to be done.
R_1FFoneLofkLlbgM,"The data capture platform seems useful to track the collaboration in live time. With the keyword tracking and recording, it would be easier to figure out what the team discussed, etc..","To evaluate an individual participant's contributions to a collaborative group, it would be helpful to have some kind of tracker that lists what each person did at what time. ",I think the process and the final work itself would be enough to evaluate collaboration quality at a group level. ,"I would like to see if my teammates are putting in their best effort on completing the tasks, etc..","I would use them to either help or encourage my teammates to work harder, etc.. ",I would like to see an evaluation of our final work.,The evaluation of our final work would be useful to see how we did and think about what could've gone better during the process of achieving the final work.
R_1LTMuPYAjJv43F3," EDC software is an electronic data capture solution that lets surveyors, clinical researchers, and other field teams collect data via electronic forms. It streamlines data management and helps replace traditional paper-based forms.",Team members feel nervous to give feedback or are unable to accept it themselves.," Team members would like to  take responsibility or admit to mistakes.When it comes to developing something totally new, good collaboration means having honesty and willingness to change to make things better. Good collaboration is, ‚Äúwhen someone takes your ideas, tells you you‚Äôre crazy or impossible, and then works with you to make them better,‚Äù said Engineering Manager Sean Xie.  Fellow Engineering Manager Dennis Stevense added that to him, being able to brainstorm together is a critical element of good collaboration. It‚Äôs about ‚Äújamming on ideas to come up with a creative solution to a challenging problem together.‚Äù","Good collaboration requires inclusivity. Our Research Design Lead Heather Young explained, ‚ÄúEveryone‚Äôs voice is heard, and everyone feels their opinion is valued.‚Äù She also pointed out that it‚Äôs essential for everyone to understand their role and the power of their own skillsets amongst the group. ""The most important thing is that everyone is aligned on what value they bring to the table, what the mechanism for collaboration is, and what the intended outcomes are.‚Äù","According to Head of Strategic Sales Maggie Peressini, good collaboration is ‚Äúwhen everyone is focused and working on the same outcome.‚Äù Whether you‚Äôre ‚Äúlooped in‚Äù or ‚Äúworking in lockstep‚Äù or ‚Äúaligned towards end goals‚Äù, good collaboration requires that everyone know who‚Äôs responsible for what, when it‚Äôs being done, and what the end product should look like.","Alone it‚Äôs easy to burn out. Good collaboration prevents that, allowing you to move at a pace that feels manageable and can survive the long haul. Software engineer Flavien David said, ‚ÄúAlone you will probably go faster, but surely you won‚Äôt last long. As a team that collaborates, you will always be more resilient and go further.‚Äù","Sometimes the temptation to engage in post hoc analysis is motivated by a desire to produce positive results or see a project as successful. In the case of pharmaceutical research, there may be significant financial consequences to a failed trial."
R_2qz4UOOnjFSAe2Q,"The purpose of this platform is record parts of the collaboration and analyze them. You can see the transcript of the collaboration, see the direction of the discussion, and the tone. ",Reports from the individuals group mates on whether or not they contributed their work in a way that benefited the team. ,A summation of everybody in the group's reports on every other individual. Also ask each member what goals they had during the collaboration. ,"Communication, cohesion, and the see if there's any conflict between the group members. ","I would use it to put out fires during the collaboration process. If we do not have good cohesion because people have different goals, I would like to be able to fix the problem in real-time. ",Reports on how every individual felt about every other person in the group and feedback about the group as a whole. ,See if there's any concerning trends within the group and see how to improve for next time.
R_3Ed53RAD7N36jYq,To get more info on participation. This can help with collaborations because you'll know what to improve on.,"Participation/engagement in discussion, the level of prepared-ness going into the collaborative group","Participation/engagement in discussion, the level of prepared-ness going into the collaborative group",Participation,"Percentage of total participation, but also depends on how prepared this person was",Participation,"Percentage of total participation, but also depends on how prepared this person was"
