R_10JhWQh64h9XaPd,The data capture platform can measure the direction of a discussion using audio capture. The data capture platform can generate keyword lists from a discussion.,"I would need to know how they've contributed to deliverables, the compromises they made with other group members to coordinate schedules, the way they've communicated with their group.","It would be nice to see how the group reacts to insights from individual group members, and how the group either builds/acts on their ideas or finds a way to suggest other ideas.","I would like to see people's body language, expressions, and comments in responses to their peers in real time.",This information taken together provides a good measure of the group dynamic and any potential tension between group members. ,I don't think I quite understand the question but after the collaboration I would like to see that the group members are comfortable with each other as well as the deliverable they've worked together to complete.,I would probably use this information to make statements about what drove the success or failure of the group in completing whatever they were aiming to complete.
R_ac2WakKqAtuvC2B,This data capture platform serves to increase the efficiency in collaborative learning. The platform allows users to effectively plan out a meeting in advance and even during the actual collaboration.,"It would definitely be the amount of actual contribution of the individual. In my opinion, time commitment does not matter as long as the individual is doing his/her task with in the deadline.","That would be the relative time it takes for the group to finish a task. If group A had to spend an hour for a paper and group B spent 3 hours, group 3 did not spend quality time. ",,,,
R_2RaDT1IZY4mCEVC,"The purpose of the platform in the video is to provide real-time analytics of a discussion on the platform. Each individual participant is given metrics on their participation time, as well as the qualities of their contribution such as confusion or emotional tone.","It would be useful to get input of how long they're talking for, their tone (receptiveness to ideas), and their question/response ratio.","It would be useful to get the total time spent talking, if there's overlapping talking (people talking over each other), and how often each person is contributing.","In real time, I'd like to see who's talking at a given time and for how long, as well as the volume, and overlapping talking.",I would use this real-time information to determine if it seems like one person may be talking for longer than others or not as much.,"After the collaboration, I'd like to see the percentage of talking contribution (how much each person talked) as well as the talking to silence ratio.",I would use this post-hoc information to see who needs to contribute more in the group.
R_33pxfV5Q06nX3Ra,It visualized the captured data on the platform and able to somehow abstract away the data collecting process.,"check github contribution or give out survey to each members in the group to have a seperate evaluation. What's more, if there is any doubt, it is strongly suggested to have ""work evidence"" and submit those at the end of the project.","Paper work, submission records, meeting records, github contribution frequency and contents, survey results from team mates",it is hard to define because we all have bias through the "quality". But I would say its about the feedback given between the team members.,"I would use it to improve myself, make the collaboration better next time. For example, I will read the feedback and to see which part I need to improve.","I would like to see feedback report, peer evaluations and project evaluation after the collaboration.","I will use the report to check whether I am a good collaborator, use peer evaluations to check where exactly I need to do better and the project evaluation indicates how's the checmial reaction between our team work."
R_RIxJuNXuj2BJcAN,The app gives discussion facilitators real-time insights into student groups which enhances collaboration. You can use Respeakers to start discussions based on key words.,How much time they spent on the tasks; what alternatives they considered; how did they arrive at the solution,Were deliverables met? How was the work flow in the team? Did everybody feel included?,How is the work flow in the team? Does everybody feel included? Do arguments escalate?,This information would be useful because it would point to the root cause of the issue.,Keeping in touch? Post-project feedback and reflections; whether or not our deliverables were successful,I would use it to reflect on my performance and do better for the next projects
R_2urD5tIwYUiOj20,"I believe the data captured is useful to understand how the team members are communicating with each other. In the case that there is too much negativity or harsh words that are being said in a group, it would be great to quickly understand what is going on and whether everyone in that group is comfortable with that is being said",I would need to know that an individual is focusing on the something that no one else in their group is focusing on. ,"I would need to know the strengths of everyone, in the hopes that everyone in the group has a unique strength different from the others in the same group. I believe it isn't much helpful to have people with the same strengths collaborate together.","I am not sure that what I would like to see for collaboration quality would be able to be seen in realtime, but if I have to say something, then maybe the time each individual is putting into collaborating on a project can be tracked and publicized for everyone to see","This information should at the very least show the people making the best efforts in collaborating. A good observation would be witnessing similar times of collaboration efforts. Obviously, if someone is putting way less time into collaborating, then they can be called out to do better",I would like to see the end results of whatever each individual was working on.,"It would be great to analyze the time each individual put in, and the end results of the work they were doing"
R_3fNnPoyvKZVtFNx,"The platform describes seems to primarily be used to record discussions in a group and then allow one to analyze the discussion. Various details can be assessed like searching for keywords, the amount of questions being asked/answered, the amount of silence, etc.",Communication of the work they have done would be a clear indicator of their contribution.,"At a group level, an updatable planning document that clearly shows the progress done on the collaboration would be useful.",Asking questions to other team members or for them to review the work they've done is a good indicator of work being done and efforts to increase the collaboration. ,I would use this as an indication of quality collaboration and respond to the requests given.,"After the collaboration, I would like to see that each team member has a better understanding of the principles relating to the subject of collaboration. The quality of the result of the collaboration should also reflect this. ","I would likely evaluate my own performance in the collaboration from how much I learned from it. Additionally, if I collaborate with the same teammates in the future, I would keep in mind their understanding of the topic and strengths."
R_2wTvWSVzRf2l6lc,The data capture platform captures real time data about the discussion. It can track the frequency of certain words and also track the emotional tone the conversation is moving in.,"time spent, quantity & quality of work done, commitment level",how well everyone got along,"time spent working together, frequency of communication ",to determine how well people got along,the level of satisfaction about the final product ,to determine whether the time/effort they put in is in par with their satisfaction toward the final product 
R_bCQExzbn4EOeIzD,I t was a voice recording tool. it was used to search for keywords in a discussion and attempt to track collaboration. ,I Think evaluating someone's participation in a collaborative environment is counterintuitive and will almost always lead to more competition and less collaboration. ,I think evaluating a groups collaboration is best done by asking if they were able to adequately complete the task. ,Number of interruptions. ,I htink if a person is inturupting others often then they are decreasing collaboration and should be warned or removed. ,number of total ideas pursued or brought up and by whom. ,To judge if many people tried to participate. 
R_XAqygvve3rpcbUR,"I understand the intent behind monitoring and classifying group discussion, but I really don’t believe this will be helpful. I imagine that this would just make group mates afraid to interact genuinely and hamper communications instead of aiding them.","How much time was put into the group work, for one. If there is a specific task an individual has, it would be important to know to what extent it was completed.","The quality of the final product, the cohesion between all of the different parts, the completeness of the collaboration, and the ability of any group mate to explain what the project as a whole is about. ","I‚Äôd like to see what other people are working on, what they‚Äôre struggling with, as well as progress updates.","The progress updates would just be for my peace of mind to know that the project will eventually come together, and to inform my own timing. I‚Äôd want to know what they‚Äôre struggling with to know if I could help somehow.",Maybe how we could have done parts of the collaboration better. I‚Äôd also like to know how whatever project is was was received in the community.,This information would exist mostly just to evaluate how well the collaboration went to inform future decisions of whether I‚Äôd want to work with the same people in the future.
R_2pQN7Q9gVCaVhbr,The purpose of the platform is to make the group work more effectively. And it helps the group members.,You could check their attendance of the group meeting. And check whether they finish their work,Whether all the members can attend the group meeting and communicate effectively.,See other people's reaction and check whether they understand the work that they should do.,"If they don't understand based on their reaction, you can teach them how to do their work","To make the collaboration more effective, you should see whether other people understand their work.","After you check whether other people understand their work. If they don't, you can teach them."
R_3MKAflZcpSSyd89,"The data capture platform described in the video aims to give insights (information) about group discussions through the use of Machine Learning. The application records the discussion, and based on given keywords, calculates metrics such as emotional tone, analytic thinking, etc. This app can be used to understand how collaborations/discussions have progressed.",Information such as how much time they've spent on the collaborative effort outside of the collaboration time.,Amount of work getting done,Focus levels of collaborators.,"I would use this to keep track of who's collaborating as they should to the collaborative effort, and if someone isn't focusing on the task, I could warn them to get back on task.",Time spent focused on the task and amount of work done.,I would use this information to tweak the methods of collaboration to maximize work efficiency.
R_1FG4b47aE6RGm16,"The purpose of the platform is to gather audio data from a collaboration to understand the quality of the collaboration. The data can be used to know different aspects that worked well or fell flat (analytical thinking, clout).","Knowing how the others in the group feel about their contributions would be very helpful, along with knowing the time they spent in comparison with others.","Again, feedback from the different members is the most important piece of information. Additionally, being able to see the performance of the group members before and after collaboration.","Time spent working by each person would be useful in real-time, along with engagement level and knowledge retention if that can be measured in some way.","It would be useful to know which group members are actually benefiting from the collaboration, and which members either aren't doing anything or need a different group/different process for learning.","Useful information would be measures of the different students' academic performance on graded subjects, or drive to keep learning and collaborating with other people.","This would be used to know which students need some sort of change in how they work. If collaboration isn't yielding better results in some way, they would need something new."
R_3oNH2IC3958odE0,,,,,,,
R_2V88ZG2gswS5EiZ,The data platform provides extremely useful collaboration statistics such as discussion direction.  This ensures that group work time is spent productively and time isn't wasted as much.  ,effort and openness,"schedules, background knowledge",effort trackers,help manage workloads and ensure equal participation,what everyone thought about others' effort,help analyze why people would do more / less work in collaboration and provide further context
R_3lKf1UBRoizaINT,The data platform can be used to analyze collaboration sessions and provide feedback on areas of strength and areas of growth. This can allow people participating in the collaboration session to reflect on the session and potential changes. That way they can better grow and improve and have more meaningful sessions in future. ,"If they don't overshadow everyone else, they have unique ideas, they say things, etc. But I don't really judge people all that much/harshly","Diversity and creativity of ideas, everyone being happy and feeling heard and valued. ","I'm not entirely sure. Maybe people giving their opinions on how things are going and answering whether they feel heard, etc. ",I'm not entirely sure. ,Debriefs on how people felt things went. ,You could analyze and compare them I suppose. I'm not completely sure. 
R_25vJJi3971yVOXF,It is a data capture dashboard that performs audio analysis of conversations for educational and work,,,,,,
R_2eWQYbCNzRswCX6,It is supposed to help chemistry students learn. It tracks learning insights. ,"Work done, difficulty for that work, time spent ",I don't know ,I don't know ,I don't know ,Nothing ,I don't know 
R_3fPG3wtQZ2bCksb,I am not sure. I watched the video but I was still kind of confused about what the point of it is. ,I do not think that there is an amazing way to measure it. If someone is not doing work sometimes they have reasons and do it at different times. I do not know how to best judge someone. ,What people are doing what parts of the project. And who is organizing everything because organizing all of the work is one of the hardest parts of being in a group ,I do not really care. I will know because I am doing the work with them and will be able to see what they are doing. If they do not want to work that is a problem with me and then and not the teacher until it becaumes too loarge of a problem . ,I would not use it. I would not use it. I would not use it. I would not use it. I would not use it. I would not use it. ,"Nothing, Nothing, Nothing, Nothing, Nothing, Nothing, Nothing, Nothing, Nothing, Nothing, Nothing, Nothing, Nothing, ",I would not use it. I do not know why there are so many questions about this. 
R_3NIMterHNvrAArg,"The platform helps with understanding the contents of a discussion, split by discussions, questions, and silence. It allows for discussion moderators to better understand the discussions of groups ",How well other members of the groups understood or processed the information that individual shared.,Overall group dynamic and success,,,,
R_3NPy5BZCYqrxS5k,It is used to provide instructors with real time insight into each group. It's main overall purpose is to help improve collaboration among students.,It would be useful to know what they contributed and the efforts they made in completing that task if it hasn't been completed. Often times a task may not be completed by there was a lot of effort put into trying to figure out what the issue was,,,,,
R_3qfIC3PFxrHc3fQ,"I can see how this can be potentially useful in measuring real time info. But at the same time, I feel that this increases pressure among teammates",How much effort they put in a certain assignment. How responsive they are to messages and feedback.,A time table that measures the progress of people's work during the project timeline,"Honestly, I have no clue by this question. This is a bit too vague for me.",I'm not really sure what I would use with the real-time information,I would want to see the performance of team members compared to other people.,"Perhaps, we can use this to identify potential issues or flaws that needs to be corrected or fixed."
R_26g1gmzUSabC1Dy,The platform monitors discussions in group collaborations and uses machine learning to describe what direction the conversation is going in using keywords. This allows a teacher to see how well the group is performing and what direction their discussion is going in. It also captures the tone of the conversations.,Information that would be useful to me for evaluating an individual's contributions would be to see how much work they have contributed and that they have been present at the team meetings.,Information that would be useful to me for evaluating collaboration quality at a group level would be to see what kind of grade the group received or if they achieved their outlined goals,If the goals that have been outlined are being accomplished at the pace that the group hoped for. ,If the information points to the group not performing well then I could use this info to figure out ways to improve the performance of the group.,I would like to see how much time was spent trying to convince the other group members of a specific idea or path to take.,To see if there is ways to pair up people in a more efficient manner so that less time is wasted with groups that include individuals that want things done their way and are not willing to compromise.
R_ueVpBfIgsnNePZL,"The data capture platform described in the video provides results for collaboration among peers, in different segments and in real-time.",peer reviews,peer reviews,"peer reviews, summary of work completed",to understand if there is equal balance of roles and work,peer reviews,to understand what went well/what could be improved
R_2gV0DrrqG5aAZ8Z,"I definitely find it a little creepy, not sure how I would feel being recorded during a discussion.",Are they actually participating and helpting,Did we get work done                                                                          ,,,,
R_eqtQ53V9eIhqsyl,"The data capture platform intends to capture data about the collaboration quality of various members of a collaborating group. It segments data into analyzable sections such as emotional, clout, etc.","If it is a problem set for example, how many questions each participant took the lead in answering.",Evaluating if it's just one person doing most of the work or if everyone is contributing equally.,"Edit history (if some sort of paper), or signatures under problems that each person took the lead in solving (for a problem set).",It would be manually evaluated to analyze the collaboration quality.,Each person providing an anonymous evaluation of their contributions and others.,You would cross evaluate the evaluations to determine each party's level of contribution.
R_WwXcEhguM2LhrVv,"The purpose of this data is to give teachers clearer insight into the discussions that their students are having, with the directionality of the conversation, the emotional tone, etc.",Some ideas are tracking document changes and the amount of time spent talking.,"I think seeing the rate of document changes and time spent talking per member, and making sure that they are more or less equal. ",I'd like to see tracking document changes and the amount of time spent talking.,I'd use this information to help out group members in either being more assertive or giving others more space to talk. ,"I'd probably like to see the same kinds of information before and after, with maybe some input as to who contributed the most on-task items.","I'm honestly not sure, but probably similar to how I'd use the real time colalboration. "
R_YWXRUalNtSgBPVf,"The data capture platform records and transcribes discussions and creates an analysis of the discussion. It tracks keywords, timelines, moods, and other metrics of the discussion.",,,,,,
R_1g75BW8yTM8wDjZ,"Seem really cool, provides data points about what people are saying and detects keywords, also records how long people are talking for and when they fslk","How much you hear or see them contributing, maybe marking what parts of a project they did",The level of conversation being had and also the relevancy of that conversatjon,Audio visual cues ‚Äî conversation and peoples expressions,"I feel like this is pretty self explanatory- if it‚Äôs loud you know they‚Äôre talking, if people look unhappy they‚Äôre probably not communicating well",Maybe an exit survey or something like that to evaluate ,"Again, pretty self explanatory ‚Äî people can rate their experience"
R_248eKFTicOaRo1Q,The platform observes a collaborative discussion by listening. It provides data to analyze the discussion in both real-time and post settings.,Noting which participants contributed to each part of a project. Peer reviews as well.,A summary of work written by the group as a whole. Individual evaluations of group performance produced by each participant.,"Data to help gauge conversation, such as number of words spoken or number of individuals involved in the current discussion.",I would use it to find collaborative groups that are struggling and step in to mediate.,Each participant should write down one thing that could have or should have gone better.,Present it anonymously to the group before their next meeting time.
R_UaPi8yjwuuflGIF,"The functionality of the data capture platform shows where the audio of a contribution to collaboration is from, some key words used, and categorizes contributions.",How much time they spent working on their portion of the project and the overall impact of their contribution.,"How roles were allocated, what each person contributed, and how the group synthesized a cohesive project from each member's contribution.",I'm not sure what this question is actually asking. I think having real-time collaboration quality may undermine student privacy.,Still unsure on this question.,What each member contributed to on the project.,"If I were less knowledgeable on a certain part of the project compared to the whole after the project's completion, I may ask this group member some clarifying questions."
R_1P100Lhdn3UpqTU,The purpose of the data capture platform is to capture the data of collaborative efforts ,"In pair programming, how much time someone spends doing the programming and how much they're able to get done maybe.",How much a group gets done at the end and how much each individual steps away with ,,,,
R_1d07HuVyZkdX2mY,Capture key words on the dialogue of a session. Figure out points of disagreement. Keep a record of quality of collaboration for evaluation.,significant lines of code,ranking among other collaborations,Survey based sentiment analysis,Read in my leisure for enlightenment,Final projects,Understand my ranking amongst the larger group
R_2ZEPQ73TcfAZkOu,"The goal is to analytically look at how collaboration works.  To do this, the tool looks at a transcript to determine things like keywords and tone and provide a neat summary to whoever might care to look at it.","Perhaps amount of time worked, or volume of work produced if this is measurable.","Whether people get in each others' way or have to pick up other people's slack, as well as whether the group can meet the standards set before them.","What work everyone is focused on, and how it relates to the larger picture.","It'd allow one to ask others for help if they aren't busy, or to communicate based on how related a given project is.","I'm not sure what this means, but I'd presume how everyone felt it went compared with whether everything that was set as a goal was actually accomplished.","Hopefully, to improve the group for the future, reminds me a bit of the post-sprint analysis of agile."
R_1QQ3QRH9RWiUhGN,To accurately understand the dynamic of group collaboration.                                                                        ,"To see what they are actually able to accomplish, but also to understand their role in the group.",Communication channels and whether or not all members of the group understand the assignment in the same way.,Progress of a project and blockers that members are facing prohibiting them from completing their tasks.,Progress allows someone to understand how far along the process is and to create an accurate and updated timeline for the group.  Identifying blockers can help an individual reach out to others to seek a solution.,A rundown of what went well and what could be improved for the next information.,For iteration.                                                                                                                  
