ResponseId,Q19,Q51,Q52,Q57,Q55,Q58,Q59
R_BGsuiDtfSpfszwR,It would monitor what we are saying to give real time statistics into our conversations. The primary benefit would be in retrieving a transcript of the conversation.,,,,,,
R_ApM8GmaqSahhY77,"The data capture platform described in the video is used to analyze a collaborative conversation. It records the conversation transcript and provides data insights on the types of words, different speakers, etc.",,,,,,
R_1rCxtQPuxNPiNl0,"Collaborative learning and for supporting learning, really interesting and a tool I can definitely see myself using",,,,,,
R_XuF9ngNLHK0tuTv,The Blinc platform provides learning groups with a data analysis toolkit for collecting conversation. It uses a respeaker or computer to take input in the form of audio input and processing it. The platform determines trends or topics in the speech.,,,,,,
R_xneQiVtX0IZBwlP,,,,,,,
R_10BClJ7XamtOYZP,,,,,,,
R_1OIfTAAOmwr7aWI,,,,,,,
R_3nqLdcjnMETd1Rv,,,,,,,
R_Rt2iLsAuTmR5Zm1,,,,,,,
R_2qh243BfD86Kbyv,,,,,,,
R_1gINAlRSXv0Xixz,No comment. .                                                     .                                                       .                                                      ,"Effort, attendance, listening.                                                                                       ","Effectiveness, timeliness, quality of work.                                                                       ",Progress.                                                      .                                                      ,Assess places of trouble and improvement. .                                                      ,"Grade, time taken, team satisfaction. .                                                      .                                                      ",Assess chemistry and areas of improvement. .                                                 .                                                           
R_0pmjCebYI0HSB3P,"Let everyone show themselves publicly, and other students can understand others more directly to improve themselves",each person‚Äòs understand to the goal and what skills they already have,The quality of team member communication and understanding of task objectives,"Everyone's task progress and plan, as well as current problems and approximate completion time","I will record this information, it is a good reference material when encountering similar projects later","Practical takeaways from the project and help in other areas, and how to improve on completed assignments","I will summarize the gains and knowledge of the project, and summarize the problems that need to be paid attention to when working in a small group"
R_12PcLTnA7K58yrd,"It appears to give both live feedback on the nature of a discussion which is also recorded for future reference. This allows users to be evaluated for their contributions in a variety of categories which may more effectively inform users how to improve their group collaborations in the future (eg. dominating the conversation, lots of emotional verbiage, lack of novel or intellectual contributions, etc.)","How much of the project can they actually explain all the way down to the fundamentals why certain choices were made. Someone who just exists in a group can tell you what the outcome to a problem was, but only someone who was doing the work of solving the problem can tell you every intricate detail of what issues came up and how exactly it was solved. Details--this is the same for technical interviews.","Does the final product look like a collection of separate projects stitched together arbitrarily, or are all the components seamlessly integrated together. A smart group of people can all solve their own problems extremely well, but unless they're collaborating effectively as a group, their final product will look like just that--a collection of solutions instead of one unified solution. ","How effectively does everyone in the group understand their larger roles and responsibilities towards the final goal, and how are they accounting for that in their designs. ","Looking for gaps or disconnects. If two projects clearly don't understand or aren't aware of their interactions, that would be the role of the leader to step in and connect the two parties to ensure all interactions are properly understood and accounted for--this avoids disconnects at the end where an interface was not properly designed, if at all. ","This is the best time for feedback about how effectively someone was able to understand and act on the requirements and expectations of those around them. Someone isn't necessarily improve significantly during the time of collaboration, so feedback from fellow collaborators after the fact on pain points and/or how to improve would be valuable. ","Using this feedback from collaborators in retrospect to understand what could be improved over the course of a project or to know potential pain points that, while you might not know how to improve them, you can warn others about and attempt to avoid, can make future collaborations far more efficient and valuable. "
R_2CqwYvmt5fFc3fL,"Collecting data from group conversation and analyze the sentences from several aspects， like tones, emotions.","mainly three information : time spend on project,  project progress , willingness to communicate",whether everyone can do their strength thing. whether all members can be kept informed.,progress of the project is the collaboration-quality information would you like to see in real-time.,"I would use this real-time information to adjust my work pace, and picture the final result.............",everyone works hard and have their expected result is the  collaboration-quality information would you like to see after the collaboration,To sum up this experience and to be the experience of my next collaboration are the way I would like to use this post-hoc information.. 
R_3gZVLc6ZnrIpLGB,The purpose of the data capture platform is to promote good collaboration. This is done through the use of speech recognition and data analytics.,"Time spent actively listening and contributing to discussion, amount of work portioned to participant completed",Peer review scores,Who's contributing to the discussion at the moment? Who is speaking? Has that speaking been effective in directing the conversation in a effective direction?,Recalibrate the discussion and direction if there's one person overly speaking their ideas or if the direction has strayed too far,"Time spent, anonymous peer ratings on collaboration",A nice idea of things to improve on individually for each person
R_2EowTWuajJzB628,It creates a transcript of audio and separates it into different sections to make it easily accessible. The purpose is to make it easier to access different parts of the discussion.,Probably just how much they talk during discussion and what role they have if roles are assigned.,I think it would be important to look at each individual's contributions as well as how the group works as a whole.,I would like to see good communication from everyone in the group.,"If everyone is able to communicate effectively, it would tell me that the group probably works well together.","Maybe some sort of follow up text/email to make sure everyone is on the same page. Also, if everyone is working on what they delegated in the meeting.",It would help see who is dedicated to making the group work well together.
R_wNbQtw8LBMDjYgp,the video was very informative. the video taught me a lot about collaboration and how to effectively collaborate with others.,I don't have any unfortunately because I never learned how to collaborate with other people effectively.,I don't have any unfortunately because I never learned how to collaborate with other people effectively.,I don't have any unfortunately because I never learned how to collaborate with other people effectively.,I don't have any unfortunately because I never learned how to collaborate with other people effectively.,I don't have any unfortunately because I never learned how to collaborate with other people effectively.,I don't have any unfortunately because I never learned how to collaborate with other people effectively.
R_28CifCvYU4vsRRT,The purpose of the platform is to allow instructors and facilitators to be able to understand who is participating and who is not. The platform also provides transcripts of what exactly each student says.,It would be other participants' evaluation of how much work that person has contributed.,"I would look at how cohesive the final results are, as they tend to indicate how much communication the team had with each other.","I would like to see tasks being delegated to different members, as well as each member's report on their progress.","I would use it to make sure that everything is on track, and if someone is falling behind, the rest of the team could work out how to hep.",I would like to see how each member of the team felt about working with the other members.,I could use this to assess exactly how much work each person has done and how balanced the work distribution was.
R_PuCNaGCwQWtlVfj,"The data capture platform allows for real-time monitoring of discussion. It highlights keyword usage, displays what direction audio is coming from, records full sentences and sentences surrounding keywords, and interprets tone of discussion.","A past class had participants anonymously evaluate their teammates' contributions and effort, which worked fantastically.",Group sentiment and opinion on how well they work together is the best idea I can come up with.,"In terms of computer science assignments, real-time collaboration information sounds like github commits or lines of code written which is not a great metric for effort or work. Maybe time invested while working in a group?",Members who don't participate in group meetings or collaborations are having less of a positive impact on the collaboration,"I'd like to see how each member felt the collaboration was, and how they felt about each of their teammates (anonymously).",This could be used by the collaborators to improve their approaches and methods for the future.
R_3niTlA9sYa30BK3,"The data capture platform records discussions, and provides analysis of the discussion. It allows you to track key words as well as monitoring certain things such as confusion or engagement.",Information that would be useful include a list of things that an individual has completed relating to the project.,Information that would be useful include a group survey just to see what everyone though about the collaboration quality.,Some good collaboration-quality information to see in real time are the current tasks that individuals are working on.,With this real-time information we can see what else needs to be worked on and how these tasks tie into each other,After the collaboration we could include a group survey just to see what everyone though about the collaboration quality.,"From this survey, we can truly judge if the collaboration was actually good, or if it just one person thought it was."
R_3PRFo6W2YA9SY2N,It allows analyzing how the discussion goes to be more scientific and effective. It's also good for review after the fact since the data will be present and you won't have to rely on your own memory.,,,,,,
R_2CKwP44gtbvjh79,The platform is meant to collect student data for use in the classroom so that students may be instructed more personally,It would be helpful to know what their goals were for the collaboration and what steps they took as an individual to achieve those goals. ,It would be helpful to know what strategies groups used to work together and whether they're goals were met. ,It would be interesting to see at different points of the collaboration what each group member has been contributing and at what point,Knowing this information would help to address task completion throughout the group and adjust according to the goals of the collaboration,It would be helpful to know which individual pieces of work contributed most to the overall goals of the collaboration,This info would help future collaborations to maximize efficiency and productivity by knowing what type of work moves you towards your goals the fastest and most effectively
R_1DoOXpPRFUND53I,Please provide 2-3 sentences about the purpose and functionality of the data capture platform described in the video.  I understand how this information might be useful for supporting learning.Please provide 2-3 sentences about the purpose and functionality of the data capture platform described in the video.  I understand how this information might be useful for supporting learning.,"I will try to communicate with those people who are not willing to participate the job, trying to ask them to finish their own work. I will tell them that only all of our group members can participate the job actively and are willing to help with each other, can the whole group finish the job.I will try to communicate with those people who are not willing to participate the job, trying to ask them to finish their own work. I will tell them that only all of our group members can participate the job actively and are willing to help with each other, can the whole group finish the job.I will try to communicate with those people who are not willing to participate the job, trying to ask them to finish their own work. I will tell them that only all of our group members can participate the job actively and are willing to help with each other, can the whole group finish the job.","I will try to communicate with those people who are not willing to participate the job, trying to ask them to finish their own work. I will tell them that only all of our group members can participate the job actively and are willing to help with each other, can the whole group finish the job.","I will try to communicate with those people who are not willing to participate the job, trying to ask them to finish their own work. I will tell them that only all of our group members can participate the job actively and are willing to help with each other, can the whole group finish the job.I will try to communicate with those people who are not willing to participate the job, trying to ask them to finish their own work. I will tell them that only all of our group members can participate the job actively and are willing to help with each other, can the whole group finish the job.I will try to communicate with those people who are not willing to participate the job, trying to ask them to finish their own work. I will tell them that only all of our group members can participate the job actively and are willing to help with each other, can the whole group finish the job.","I will try to communicate with those people who are not willing to participate the job, trying to ask them to finish their own work. I will tell them that only all of our group members can participate the job actively and are willing to help with each other, can the whole group finish the job.I will try to communicate with those people who are not willing to participate the job, trying to ask them to finish their own work. I will tell them that only all of our group members can participate the job actively and are willing to help with each other, can the whole group finish the job.I will try to communicate with those people who are not willing to participate the job, trying to ask them to finish their own work. I will tell them that only all of our group members can participate the job actively and are willing to help with each other, can the whole group finish the job.","I will try to communicate with those people who are not willing to participate the job, trying to ask them to finish their own work. I will tell them that only all of our group members can participate the job actively and are willing to help with each other, can the whole group finish the job.I will try to communicate with those people who are not willing to participate the job, trying to ask them to finish their own work. I will tell them that only all of our group members can participate the job actively and are willing to help with each other, can the whole group finish the job.I will try to communicate with those people who are not willing to participate the job, trying to ask them to finish their own work. I will tell them that only all of our group members can participate the job actively and are willing to help with each other, can the whole group finish the job.","I will try to communicate with those people who are not willing to participate the job, trying to ask them to finish their own work. I will tell them that only all of our group members can participate the job actively and are willing to help with each other, can the whole group finish the job.I will try to communicate with those people who are not willing to participate the job, trying to ask them to finish their own work. I will tell them that only all of our group members can participate the job actively and are willing to help with each other, can the whole group finish the job.I will try to communicate with those people who are not willing to participate the job, trying to ask them to finish their own work. I will tell them that only all of our group members can participate the job actively and are willing to help with each other, can the whole group finish the job."
R_2P5U7Q8uthDbPh5,The capture platform keeps track of conversations and can detect various aspects. Some important ones include the direction in which discussion came from and the tone/mood. ,Whether everyone is aware of their ideas,Whether everyone can say they contributed to the final project,I don't think there is "quality" information per se. Anything that anyone speaks deserves to be considered.,Everything should be taken into account.,I think it's less of making sure everyone is satisfied and more that the information was at least considered in making the final descison.,"Improve your collaboration for next time. If you knew someone wasn't included, try to include them next time. Maybe you talked too much yourself. Or maybe you agreed with everything so had nothing to add. Either way I think it's important to try to integrate everyone."
R_3ssu23pzcsTAlLW,"The platform records audio from individuals' devices, using machine learning to analyze and categorize group discussions. It allows you to see when individuals were actively collaborating, when questions were being asked, and when members were silent, and it also shows the overall tone/mood of the discussion.","I would want to see what effort the individual put in, as well as what ideas they contributed (even if they weren't ultimately used)","The ultimate quality of the resulting product, weighed against any self-reported difficulties in the group dynamic","Editing logs for each individual in documents, presentations, etc.",I could use this to determine the relative effort and ideas of individuals,I would want a short reflection from each individual on how they felt the collaboration went.,To ensure that there were no apparent difficulties in the group dynamic that could have impacted individual contribution or the quality of the final product.
R_2v1c8U6SGv84rY9,It can be used to analyze the broad characteristics of a conversation like contribution dynamics and tone.,How enthusiastic they were in offering (or receiving) help.,How much people would like to work with them in the future ,Whether people don‚Äôt feel comfortable speaking,Talk with them and address whatever makes them feel like they can‚Äôt talk.,Verbal quality checks,Identifying personality types that work well together
R_exv4bMixOn5eTjb,The data capture platform allows groups to track collaboration quality both during and after collaboration. It also allows groups to stay organized and on top of all tasks.,"How much work they put into the final project, how often they showed up to scheduled meetings, and how they treated others in the group.","How well the group communicated as a whole, and how well the group stayed on track in terms of time and content of meetings.","The amount of progress made at the end of each meeting, and using organization/communication to assign tasks to complete before the next meeting.",To improve upon a certain aspect of collaboration if I feel it is lacking.,To view the final product and be satisfied with the work the group did.,Recognize mistakes I made and use them to prepare for my next collaboration.
R_2schUaJKV3f2EGL,Paying attention to participation data during the collaboration is particularly important for the analysis of the collaboration.,The main information is the individual's contribution to the team's results.,"Comprehensive assessment of deliverables, team atmosphere, and collaboration.",Current work progress is an important expression of how well the team is working together.,Reconcile with plans and key milestones.,Satisfaction level of team members with each other.,"If the team atmosphere is good and all team members are satisfied with the results, then it is a successful collaboration."
R_2RQaoX7jBQDuV4E,The online dashboard that gives the discussion facilitator several real-time insights into each group.,How they participate every meeting. How fast they response when the problem occurs.,If we complete the work in a good status and communicate easily and smoothly.,We communicate easily and complete the work in time and well.,,,
R_BDOvZY4whUpceZj,The purpose is to observe collaborative learning. The functionality is an online dashboard that gives the discussion facilitator key insights into the group dynamics.,,,,,,
R_2Pbs0pGfPs7HvBD,"It seems like the purpose of the tool is to capture important insights about what is said in the recordings that may not be easily noticeable by a human, such as keywords and other nuances/rhetoric of the speech. I think it could definitely provide some information that people don't notice every day.","I think having evidence of the work done by each person would be helpful, such as knowing what parts of a presentation they created.",The overall work of the group considered as a whole would be useful for evaluating quality.,"It could be useful to see how a collaboration is coming along, such as a progress chart.",Being able to track the progress of a project would be good because it could encourage people to be accountable.,"Detailed feedback would be helpful, considering the quality of the work as well as the quantity.","It would be good to allow group members to reflect on what went well, and what to improve for next time."
R_3scVs4NA7yJxMER,"It is supposed to be used to anlalyze speech on multiple different levels. These levels seem to include subject matter, tone, and emotion among others. I think this is a really cool device that could have a lots of potential.","How much they communicate, how often they make good on what it was agreed that they should contribute to the effort. How much of their relevant skills contribute to the effort in general.","Productivity, constructive behavior, balanced allocation of responsibility, and synchronization are all important bits of information.","Productivity, constructive behavior, balanced allocation of responsibility, and synchronization are all important bits of information.","Allocate responsibility and deadlines based on how well you believe the group can perform: Productivity, constructive behavior, balanced allocation of responsibility, and synchronization.","How well everyone in the group, collectively and individually performed, Productivity, constructive behavior, balanced allocation of responsibility, and synchronization.","Take the lessons you learned from trying maximize how well you demonstrate: Productivity, constructive behavior, balanced allocation of responsibility, and synchronization, and map it to how you've improved in what you do overall as a collaborator, and go from there."
R_3O8JmhvSW3jHU4S,The purpose of this data capture platform is to enhance group collaboration by collecting and analyzing certain metrics. It is meant to be used by group members. ,"I think if you could find a way to measure the impact they had, whether it be the guide they had on direction or direct work they did. ","I would say both how well their worked turned out, and then a survey judging on how smooth their group collaboration was at a social level. ","I would say reviews judging the quality of your groups works, as well as the participation of others. ",First off to make sure that the group dynamic is still working. Then to increase the quality of work and production. ,"A review on how each member thought they did in the group, as well as what the group dynamic was like. Also any thoughts that they would change. ",I would use it to better my method of selecting groups for a class or project setting. 
R_1PSEWcXDWPI7xA5,The purpose of the device is to gain insight into what is going on in discussion. It listens to discussions and provides metrics like a timeline of type of statement and measure of emotion level. ,The number of lines of code they committed on a coding project. ,Surveys by group members on the participation levels of other members. ,The relative amounts that different group members speak in discussions. ,I would look into the outliers to see if the member is either not participating or is dominating the conversation. ,Surveys by members of the group about the performance of other group members. ,I would investigate any instances of negative feedback to see if the group member was harmful to the group. 
