R_1mLByG4loMzJX7f,There is a better visibility of discussions. There is a better visibility of discussions. There is a better visibility of discussions. There is a better visibility of discussions. There is a better visibility of discussions.,I am not exactly sure about What kinds of information would be useful to me for evaluating an individual participant's contributions to a collaborative group,I am not sure what kinds of information would be useful to me for evaluating collaboration quality at a group level,I am not sure what kind of collaboration-quality information I would like to see in real-time,I am not sure how I would use this real-time information in all honesty,I am not sure what kind of collaboration-quality information I would like to see after the collaboration,I am not sure how I would use this post-hoc information in all honesty
R_21u2ciCnhSJFvLj,Data captured in real-time can be seen on the dashboard. On the dashboard we can see keywords and distribution of data etc. ,How much they know about the outcome and also about the process the group followed. Comments on other group member's contributions.,"Again, the quality of outcome. Group member's knowledge on the process. ","Results of smaller parts of the project, elaborated by a different member each time.","We can derive the participation of the group member who is presenting, and also if there was enough contribution by others.",Comments on each other's contribution.,We have a good probability of getting to know every group member's contribution and the group's collaboration quality based on these comments
R_2uWkPpWUA9Aosgb,The platform described in the video provides many useful characteristics. The ability to use keywords can definitely better increase understanding of the discussion content.,I think a summary of what each person contributed would be useful in evaluating the individual contributions in a collaborative setting. ,I think being able to understand everyone's strengths and how that translated to the final outcome is a good sense of information. ,"I am not sure what collaboration-quality information is referring to, but I would say speaking clearly and being vocal of one's own opinion. ",I would utilize it to better understand what level of understanding exists in the team and whether or not someone feels left behind.,I think a reflection from each members serves the other members in understanding what went right or wrong and using that reflection to better impact future experiences.,I would take note of what I can improve on in order to grow in those areas in the future. 
R_22QuUOHZyM8pOuF,"Platform is for analysing discussing. Also, it aims for helping communication. ",self work evaluation and expression. evaluate by other team members at the same time. ,what a team finished in the end.,"ideas, processes percentage. ",evaluate every members' work.,everybody's self-summary. ,learn from other's work. See what I should change for better team working. 
R_21vuDNVBOW6dgwZ,Used to collaborate with people effectively. To ease out the process of communication and collaborations. ,"Quantitatively, can be assessed through various parameters around the project. Qualitatively, can be judged through soft skills - punctuality, honesty, dedication. ","Quantitatively, can be assessed through various parameters around the project. Qualitatively, can be judged through soft skills - punctuality, honesty, dedication. ",Flexible towards the novel methodologies to obtain a high quality output. ,Inculcate these values among the team. ,Be content and composed after the output is achieved post collaboration. ,Try to implement the above information to my best and evaluate where do I stand. 
R_3sypEc5kY6Jq6vb,I watched the video but I am still confused about the functionality and necessity of this platform,I would like to know more about their background and skills and their level of interest in the subject matter,How well each person learnt from the collaboration? Did anyone learn something new from someone else in the group?,I would like to be able to have some metrics against which we can see if this collaboration is beneficial or not,I would use this while working in groups so that we would know if anything needs to be changed,I would like to see how well we did and what are the areas of improvement,I would use this to do better next time and learn from it so the collaborations can be better in the future
R_2P5aQJPkL3QaP0r,"I have used a similar application called otter.ai. Bascially, it keeps a record of all your meetings with transcripts and you can make notes from them which can be shared with the class",,,,,,
R_2VyZTXjKKTViJ58,This is for us to discuss the problem. This is designed for us to evaluate oursleves in the process of discussion,How the work he has done contribute to the final output of the group and what character did he play in the whole group.,How the group members' work depend on the others and how these members solve problems basing on the others' help.,The progress of the members that will cooperate with me and what kind of problem that they have encounted,I will adjust my progress based on his progress and I will see whether I can solve the problen that he has encounted.,People solve problem together and when they have some problems they will turn to others for help.,I think I will use them to adjust my action that is whether to solve the problem on my own or to turn to tohers for help
R_1PTReCtWBKdJE36,The purpose of the data capture platform is to gain data during collaborative learning. This data will then be used to find ways to improve learning. ,The other group members' opinions may be somewhat useful in determining an individual's contributions.,Each individual's group members opinions about the overall group quality and the pros and cons of their group would be useful.,Each group member's real-time level of satisfaction with the group and what they think is going well or not.,I would use this information to determine what specific instances could cause frustration amongst group members.,"Each group member's overall satisfaction with the collaboration, how they felt about the other members, and what they thought went well and what didn't.",I would use this information to determine what causes a low satisfaction level.
R_12JtatHrXymA5F6,'- The data capture platform allows people to check the quality of the collaboration - It allows us to asses the direction the discussion is going in - It allows us to judge the quality of the conversation,"- how many hours of the total hours required they worked, how many % of the total sections they contributed to","- whether everyone contributed to equal number of sub sections, whether everyone contributed an equal amount of hours","- number of people working on each section, who is currently leading the group, hours worked by each person","- evaluate if people are contributing to equal number of sections, are working roughly equal number of hours, are taking the lead from time to time","- of total discussion, how many hours each person spoke",'- use this to find out if everyone is contributing equally
R_2YMx8MGut7cXNVb,"It is supposed to help with collaboration. It analyzes emotional tone, analytic thinking, clout, authenticity, confusion.",What they exactly contributed to the collaboration and how they contributed it.,If everyone is on the same page for collaboration and there are no conflicts.,How well members bounce off each other in collaboration and whether people are putting in work,To determine whether a collaboration is good and to apply it to my future collaborations,I would like to see group members get together again for another collaboration ,I would use this information to determine whether a group is good and whether I would want to collaborate with them again 
R_XmGHr5iAHR74uHL,"improve collaboration and learning;  Effectively record points of view during discussions and collaborations, which can be used to facilitate communication and better collaboration.",Peer Evaluations,Instructor Evaluations,Ensure that groups know how each member is doing by integrating assessment throughout the project.,Allocate tasks properly,The result and review of cooperation,To improve and optimize the product
R_1Q6hWtKp6waEY5t,It is supposed to analyze different expressions within discussions. It can pick up on emotions and/or the tones that are going on in the discussion.,"Time and effort that said individual spent in the group. Also, measures of what they were actually able to accomplish and get done or what they were able to learn and communicate with the group.","Usually, the best way would be to see if the group is accomplishing the goal that they were set out to accomplish or at least making good progress towards that.","It is helpful to see that all group members are actively engaged in what the group is trying to accomplish. As in, everyone is talking or everyone is trying to do SOMETHING helpful.","As a part of the group, I would use this information to ensure that everyone feels like they are being included. I would also want to ensure I am not taking anything over on my own.",I would like to see the progress that was made on the project / assignment. I would also like to see how the group members felt about the collaboration overall.,You could use it to figure out whether groups need to be changed. You could also use it to inform a group about things they should be doing differently or people they should be trying to include.
R_AHUcntqFNdD9W5r,"The purpose and functionality of the data capture platform described in the video is to evaluate group discussions, and understand and classify the content.",The efforts they put in as compared to the other team members.,Efforts by the team members,"The efforts made by the team members, the team's way of considering inclusivity",In evaluating collaborations in real time,The metrics by which we characterize a good and bad collaboration,In evaluating collaborations in the future
R_YS4Pp7G5ihNGEtX,"It's a discussion facilitator that is like data visualization, which can help on research, group works. It can record real-time discussion, at the same time, abstract keywords from real-time discussion. In addition, it can analyze discussion datas by using machine learning tools. ","This participant's attitude, patience, responsibility are the most important.","Collaborators' responsibility, responsiveness, support are important, also collaborators need to understand that one group shares the same goal.","Such as GitHub contributions, each collaborators' records",GitHub's records can be used to check each collaborator's contribution,Meeting notes or weekly report from each person,"Check to see what each collaborator is doing, and going to do in the following week"
R_tJrMowcGWnvWbDz,"The data capture platform described in the video relies on audio recording of participant interaction. Using this recording, it presents a transcript and data regarding the collaborator discussion.",What parts/ideas they contributed to the project and how other group members felt about their collaboration,"Information that would be useful would most likely be group information about individual participation, as well as the overall outcome of the project.","Percentage of total project or individual tasks completed, chat for group to collaborate.",This real-time information would be used to evaluate progress and communicate with collaborators.,"After the collaboration, I would like to see individual opinions regarding the collaboration process as well as overall project success.",I would use this post-hoc information to recognize how the project was divided and to evaluate the goal of the collaboration.
R_urjQoayeecQDAsx,"The data capture platform uses machine learning to analyze conversations in real time. There are several metrics that are created for analysis, including a transcription of what was said, data diagrams, and measures such as emotional tone and analytic thinking. ","I don't think quantitative measurements are very effective here. Qualitative analysis is required to measure an individual's contributions to a group. You can observe their activity level in the group (are they paying attention, are they not paying attention, are they making attempts to participate, etc.).","The different ideas and thoughts that were shared, and the number of them that the group decided to proceed with can be a good measure of progress. Also, seeing whether the group is making progress on the overall project can be a good measure to see whether the collaborations are effective.","I would like to see a visual representation of all the thoughts and ideas presented (whether it be a Google doc, etc.). This can help to keep track of what is being shared, allowing people to ""go back"" and refer to points made earlier in the collaboration. This can foster more meaningful discussion.","I would use this real time information as a ""log"" of the thoughts and ideas shared throughout the collaboration. Using this ""log"", I can make connections between points made recently in the collaboration, and points made earlier on in the collaboration.","A summary of the points made, the amount of time each point was discussed. This can also be used to measure how substantive each point and idea was during the collaboration.",I would use it to identify the most important points made during the collaboration (points of emphasis). They can be a good indicator as to what steps to take moving forward.
R_2cbCKwDrZV1TWPT,It is a platform that allows educators to monitor discussions. Some functionalities include transcripting conversation and evaluating tone.,"I don't know how to quantify this. Things like hours of work relative to other group members or punctuality on meeting days/times could be useful, but it may be difficult to measure.","Having a system that rates the quality of collaboration would be helpful, especially for projects where you cannot choose your partner and therefore do not have as much confidence that you know the other student will hold up their side of the collaborative bargains.",How much time each individual is putting into their work,I would use this to redistribute workloads that may be unfair / identify when someone is struggling disproportionately with a certain task and needs assistance.,A graph of the time spent on the project by each person,To inform future divisions of labor in group settings.
R_vxy0jHZfaPRJqzn,"If I am not mistaken, the purpose of the platform is for people such as teachers to track different group discussions in larger settings where it would be difficult to otherwise.","To evaluate one's contributions, I would want to know what they did, how they did it, and why it was useful to the group.","To evaluate the collaboration quality, I would want to know how everyone in the group thinks the collaboration went.",I would like to see everyone putting in their best effort to provide ideas to one another.,"If you can see that not everyone is contributing in some way, I would want to find a way in which everyone feels at the very least comfortable with the group and the content they're working on",,
R_1LBQ5veJ0ndeSgk,report real time data from collaborative meetings.analyze emotions through transcription.use data to improve collaboration.,"The kind of information would be useful to me for evaluating an individual participant's contributions to a collaborative group would the number of times the person participates in group discussion or takes a leadership role, starts a new initiative , their engagement with the group discussion and the other members of the group as measured by their tone , emotion etc... ","The kind of information would be the outcomes of the collaboration , decisions made , documents, reports or anything produced etc","The kind of information would be the outcomes of the collaboration , decisions made , documents, reports or anything produced etc",,"The kind of information would be the outcomes of the collaboration , decisions made , documents, reports or anything produced etc","The kind of information would be the outcomes of the collaboration , decisions made , documents, reports or anything produced etc"
R_1LUq2wgii4Ffi68,"The purpose of the data capture platform described in the video is to be able to monitor the quality of collaborations. By analyzing the discussions taking place, the software can provide insights on to how well the group is working together and how it can be improved.","I think that a list of tasks that the individual has completed would be useful for evaluating the contributions, as I could see how much work they have contributed to the grouop.","The overall completed product/project's quality would be most likely affected by the collaboration quality at a group level, as it would be difficult to submit a finished product without a certain level of collaboration quality.","I would like to see a certain level of discussion during a collaboration session, as this would indicate how comfortable the group is with sharing ideas.",I would use this information to guide the group or lead their discussions in such a way that would benefit them. I would also make sure to make any changes to the group that I thought would be necessary.,I would like to get the individuals' opinions on if they felt like their voices/opinions/ideas were heard.,I would use this information to talk to the groups in order to make sure that they have good collaborations. I would also make any changes to the group that I see fit.
R_VJVqCzQkQr4eeo9,"To provide an audio transcript of the discussion. To capture and illustrate keywords covered in the discussion, to provide analytics such as tone and emotion of the discussion","The quality of ideas they bring, the type of questions they as and responses that they provide to their colleagues ","The diversity of ideas, how the seamlessly ideas are combined, the depth of understanding demonstrated","The number of collaborators, level of each collaborator activity quantified in percentages perhaps, the integration of different inputs into the collective task",To evaluate the level of engagement of every individual and to ensure the group incorporates every individuals input,"The number of collaborators, level of each collaborator activity quantified in percentages perhaps.",To understand how the final output was achieved by the individual contributors
R_2ypFzpi8cHfZhxs,Keywords can be extracted for topic extraction.  You can select different time periods to view information for that time period.  User behavior can be analyzed.,"How well this person's individual tasks are accomplished, and discuss whether this person is actively participating in the group.","The degree of contact of each person in the group prior to their work, and the evaluation within the group.","The level of activity in the group, and the percentage of each person in the group contributing.","The more active the group is, the more willing everyone is to cooperate.  The proportion of group members' contribution shows the rationality of the division of labor.","The level of activity in the group, and the percentage of each person in the group contributing.","The more active the group is, the more willing everyone is to cooperate.  The proportion of group members' contribution shows the rationality of the division of labor."
R_1H7SrSAm5uxibBd,Extracting information from paper or electronic documents. Converting information into data for key systems.,,,,,,
R_ptSvqTH60lWXWXD,"This platform is used to track the discussion information given a user-defined timeline. The discussion information contains communication intensity, captured keyword and tone analysis. These information helps people to evaluate their discussion from a statistical perspective.",Group survey can be a good choice.,The extent of engagement of every group member and the progress of the group project or work can help evaluate the collaboration quality.,I would like to see the average number of active communications per person.,I would use this to evalutae real-time collaboration quality and then encourage more people to involve into the collaboration.,I want to see the work performance or progress after every collaboration.,I would use this to evaluate how effective the collaboration is and then think about how we can improve for further collaboration.
R_3NKGx4NmChTHPXB,To track how the discussion progresses using features such as emotional tone and confusion. The data is captured using words from the discussion transcript.,"Number of times they attend group meetings, amount of work they have contributed to the overall group project and amount of time they have spent outside the group working on the team's project.","project milestones, and the amount of time it takes to reach these milestones. Each team member's satisfaction with the group.",Progress made with each group meeting,Keep track of the amount of work done,Reflections from team members,Provide feedback for the group members on how they can improve in their future collaborations
R_NWw3CtJdX1Z52Mh,"The data of cooperation can help us to improve ourselves to some extent, the data is presented in a very novel way, Real-time monitoring combined with Deep Learning makes for an exciting experience","Typically for programming, I will use some code analysis tools, which may help us find out which people did the most part, who contributed to which part and so on",The level of participation and discussion enthusiasm of each person,Possibly your own engagement metrics,I will adjust my status according to my level of participation,My own understanding of today's discussion knowledge and contribution to the discussion,Help me analyze my weaknesses and improve my cooperation skills
R_2uO2ZgUAWpjJwoa,It's a tool to record the collaboration. The audio data for each device are recorded and analysed.  ,The work the person did for the project. The idea the person gave to solve the problem. The effort the person put for the project.,The quality of the final product. The workload of each person. ,,,,
R_2qBEmMVZkvBRbTm,The platform analyzes several metrics of a discussion to provide real time feedback. ,Self evaluation of an individual's contribution in addition to peer reviews would be useful. ,Peer reviews about each group member's contribution to the work. would be useful. ,"I would like to see depth of the discussion, whether in class concepts are brought up, and inclusive language. ","I would use it to notice patterns in my personal collaboration, and then use that information to make improvements.","Metrics of the group as a whole, so all the metrics I described in the previous question but how it applies to the entire group.",I would use it to address group needs to improve upon next time. 
R_2X0wqMR8E3LjYBM,"It seems like the tool captures real time data on communication while collaboration is occuring. It records the users and identifies emotionality, highlights keywords etc.","I think its good to have a little information about their schedule and the amount of time they can commit to the project so you can decide on times to meet and also develop realistic expectations regarding what amount of work they can complete. I think its also important to have group members mention their relevant experience and willingness to learn, just so the team can gauge the individual skill sets and how they can best be utilized.","Communication is the best indicator of collaboration in my opinion. If a group is very communicative and members are able to articulate and explain their work to each other well, then that group is very likely to be able to collaborate really well. Level of commitment also impacts collaboration quality because it can be frustrating and difficult to work with group members who are not committed or interested in the work at all.","Metrics on communication would be helpful - how often each member communicates, how relevant/important these communications are, how well the other team members listen/understand etc.",I think these metrics could help the team direct and navigate their discussions better. If the metrics are demonstrating a lack of engagement or listening then they can redirect the conversation to try to keep people engaged with each other.,Probably similar information on the communications between group members. It would also be helpful to document each group members contributions and how they worked with one another to see if the group actually collaborated well.,This info could give insight into how much the group is actually collaborating and if these collaborations are skewed with individual team members not being engaged or not being listend to etc. This could help redirect the team and also help individuals better recognize their strengths and weaknesses during group work.
R_22XDHizetw0OZF8,The purpose of the platform is to capture and analyze audio from group discussions. From the audio it detects keywords and direction in order to inform on metrics such as emotional tone of the discussion.,"Amount of work contributed, whether they actively listen to others.",Amount of work completed and insights generated as a result of collaboration.,Ongoing work done by group members towards the project to be able to visualize who is contributing e.g. who is currently writing code,To evaluate collaboration quality and step in if there is an issue.,Summary information of work done by each member,To evaluate if collaboration was effective so that mistakes can be fixed or good collaboration can be continued.
